{
  "id": "motion/expressions/studio-glamour",
  "kind": "expression",
  "name": "Studio Glamour (A-pose default, female)",
  "expression": "an alluring, confident, relaxed expression - a soft closed-mouth smile with dimples, chin very slightly lowered, brows relaxed, eyes warm and engaged with the camera (replace the source photo's expression entirely)",
  "compatibleStages": ["pose", "motion", "scene"],
  "notes": "Default for pose-female-human.txt via DEFAULT_EXPRESSION in gen_prompt.py. Override per pose card with components.expression."
}
