{
  "id": "heroes/drakn-sisters/draknira/headwear/scene-robe-headwear",
  "kind": "headwear",
  "name": "Robe - headwear",
  "description": "a slim {{METAL}} circlet with a pointed ice crystal at the brow",
  "compatibleStages": [
    "scene"
  ],
  "tags": [
    "extracted",
    "scene"
  ],
  "notes": "Extracted from the draknira-scene-robe card so the item is a library piece (pre-stageable) instead of inline text."
}
