{
  "id": "heroes/drakn-sisters/draknava/armor/celestial-skin-armor",
  "kind": "wearing",
  "name": "Celestial skin armor (draknava)",
  "extends": "data/art/wardrobe/armor/celestial/frame/celestial-skin-armor.json",
  "varsFrom": "data/art/heroes/drakn-sisters/draknava/armor/celestial-design.json"
}
