{
  "id": "heroes/angel-primes/male/angelo/jewelry/prime-clothing-tailored-set-jewelry",
  "kind": "jewelry",
  "name": "Tailored Shirt and Trousers - jewelry",
  "description": "a bare neck, bare wrists and bare fingers",
  "compatibleStages": [
    "clothing",
    "scene"
  ],
  "tags": [
    "extracted",
    "clothing"
  ],
  "notes": "Extracted from the angelo-clothing-tailored-set card so the item is a library piece (pre-stageable) instead of inline text."
}
