{
  "id": "heroes/drakn-sisters/draknara/jewelry/scene-robe-jewelry",
  "kind": "jewelry",
  "name": "Robe - jewelry",
  "description": "{{ACCENT_SOFT}} bead necklaces with bone talismans, {{METAL}} cuffs, feather earrings",
  "compatibleStages": [
    "scene"
  ],
  "tags": [
    "extracted",
    "scene"
  ],
  "notes": "Extracted from the draknara-scene-robe card so the item is a library piece (pre-stageable) instead of inline text."
}
