{
  "id": "themes/northern/norse/cosmetics/makeup/warpaint/rune-war-paint",
  "kind": "makeup",
  "name": "Rune War Paint",
  "description": "Norse war paint - a bold dark kohl band across the eyes with a small {{ACCENT_SOFT}} rune painted on one cheekbone, wind-flushed cheeks and a natural lip",
  "compatibleStages": ["pose", "head", "hair", "motion", "armor", "clothing", "scene"],
  "tags": ["norse", "makeup", "war-paint", "runes"]
}
