{
  "id": "heroes/angel-primes/female/sandalyn/companion/cairn-beside",
  "kind": "companion",
  "name": "Cairn beside Sandalyn",
  "description": "a sturdy russet-and-cream mountain ram with heavy curled horns ringed in stone-grey bands and a thick, weather-worn coat, standing on a boulder beside her, horns lowered and steady",
  "compatibleStages": [
    "scene"
  ],
  "tags": [
    "pet",
    "mountain ram"
  ]
}
